id_product,Name_of_product,Main_image,Manufacturer,Active,Price
1,Моторное масло Motor Oil KE900-90042-R, Товары автосервиса\8FE07916.jpg, Nissan,1,2060
2,Моторное масло Helix Ultra 550046361, Товары автосервиса\F310E078.jpg, Shell,1,2120
3,Моторное масло Super 3000 X1 152566, Товары автосервиса\6CA0BE73.jpg, Mobil,0,1820
4,Моторное масло Turbo SYN Gasoline 05100-00441, Товары автосервиса\2B009062.jpg, Hyundai/Kia,1,1870
5,Моторное масло Dexos 2 95599405, Товары автосервиса\AD00B713.jpg, General Motors,1, 1410
6,Моторное масло Molygen New Generation 9054, Товары автосервиса\0DF0A8A4.jpg, Liqui Moly,1,2670
7,Моторное масло Top Tec 4600 8033, Товары автосервиса\B790A6AA.jpg, Liqui Moly,0,2580
8,Моторное масло ENGINE OIL 08880-80375-GO, Товары автосервиса\CC40C869.jpg, Toyota,0, 2710
9,Моторное масло Mobil 1 ESP 154285, Товары автосервиса\F490E078.jpg, Mobil,1,2890
10,Моторное масло Dexos 2 93165557, Товары автосервиса\45908C52.jpg, General Motors,1,1500
11,Моторное масло Super 3000 X1 Diesel 152572, Товары автосервиса\B0A0C186.jpg, Mobil,1,1870
12,Моторное масло ENGINE OIL MZ 320754, Товары автосервиса\3B70C57C.jpg, Mitsubishi,1,2140
13,Моторное масло Genesis Armortech 3148675, Товары автосервиса\C9C0F036.jpg, Lukoil,0,1660
14,Моторное масло Optimal Synth 3926, Товары автосервиса\EFC05011.jpg, Liqui Moly,1,1880
15,Моторное масло Optimal Synth 2293, Товары автосервиса\C310B9F3.jpg, Liqui Moly,1,2520
16,Моторное масло Evolution 900 SXR 194878, Товары автосервиса\E320BB7C.jpg, Elf,1,2010
17,Моторное масло Special C G 055 167 M4, Товары автосервиса\6730A31C.jpg, VAG,1,4720
18,Моторное масло Longlife III G 052 195 M2, Товары автосервиса\E5507A37.jpg, VAG,1,1910
19,Моторное масло Special Tec LL 8055, Товары автосервиса\B590AA7B.jpg, Liqui Moly,0,2420
20,Моторное масло Dexos 2 19 42 002, Товары автосервиса\23F0848B.jpg, Opel,1,1300
21,Моторное масло Gasoline Fully- Synthetic 30021326-746, Товары автосервиса\27B0C883.jpg, Idemitsu,1,1650
22,Моторное масло Formula F 15595E, Товары автосервиса\5250C855.jpg, Ford,0,1750
23,Моторное масло Zepro Euro Spec SN/CF 1849-004, Товары автосервиса\90D0B807.jpg, Idemitsu,1,2400
24,Моторное масло SN 08880-10705, Товары автосервиса\43909176.jpg, Toyota,1, 2200
25,Моторное масло Motor Oil KE900-90042, Товары автосервиса\90505D31.jpg, Nissan,1,2020
26,Моторное масло Evolution 900 SXR 194839, Товары автосервиса\F8E0B138.jpg, Elf,0,2340
27,Моторное масло SN/GF-5 SN5W30C, Товары автосервиса\5A30A7EE.jpg, Profix,1,1550
28,Моторное масло Evolution 900 SXR 194877, Товары автосервиса\E3A0B18A.jpg, Elf,1,2470
29,Трос буксировочный 12 тонн 54384, Товары автосервиса\9750DA76.jpg, Stels,1,410
30,Моторное масло Molygen New Generation 9042, Товары автосервиса\0D60A8A4.jpg, Liqui Moly,1,2510
31,Моторное масло QUARTZ INEO ECS 166252, Товары автосервиса\D0D08F32.jpg, Total,1,1600
32,Моторное масло Motor Oil KE900-90032-R, Товары автосервиса\54B0795D.jpg, Nissan,1,1450
33,Моторное масло Original oil Ultra 8300-77-992, Товары автосервиса\EF80D790.jpg, Mazda,0,2770
34,Моторное масло Longlife III G 052 195 M4, Товары автосервиса\D9605006.jpg, VAG,1,4100
35,Моторное масло 8100 X-CESS 102870, Товары автосервиса\E9308929.jpg, Motul,1,3190
36,Моторное масло Magnatec A5 15583D, Товары автосервиса\9380C1E7.jpg, Castrol,1, 2220
37,Щетка для снега со съемным скребком GY000202, Товары автосервиса\3760D73F.jpg, Goodyear,1,350
38,Моторное масло Magnatec A3/B4 156E9E, Товары автосервиса\92C0C1E7.jpg, Castrol,1,2130
39,Моторное масло Dexos 2 19 42 000, Товары автосервиса\2390848B.jpg, Opel,1,1410
40,Моторное масло QUARTZ 9000 FUTURE NFC 171839, Товары автосервиса\D2508F32.jpg, Total,1,1560
41,Моторное масло Premium DPF Diesel 05200-00120, Товары автосервиса\2D709062.jpg, Hyundai/Kia,1,1460
42,Моторное масло Special G G 052 502 M2, Товары автосервиса\E0D0E079.jpg, VAG,1,1820
43,Моторное масло Ecstar F9000 99M00-22R02-004, Товары автосервиса\21B0E533.jpg, Suzuki,1,2330
44,Моторное масло Genesis Armortech 1539424, Товары автосервиса\B0F0CB59.jpg, Lukoil,1,1710
45,Моторное масло Helix Ultra 550046387, Товары автосервиса\F2B0E078.jpg, Shell,0,2160
46,Моторное масло Super 3000 X1 152567, Товары автосервиса\F200BC2F.jpg, Mobil,1,1550
47,Моторное масло ENGINE OIL MZ 320753, Товары автосервиса\5BB0C351.jpg, Mitsubishi,0, 1590
48,Моторное масло Mobil 1 ESP Formula 152621, Товары автосервиса\DC70BEC3.jpg, Mobil,0,2920
49,Моторное масло Genuine A000989790211BIFR, Товары автосервиса\2E30E06C.jpg, Mercedes,0,1530
50,Моторное масло ULTRA 152624, Товары автосервиса\BA30C186.jpg, Mobil,1,1940
51,Моторное масло Super 3000 X1 Formula FE 152564, Товары автосервиса\59B0BE73.jpg, Mobil,1, 1890
52,Моторное масло Zepro Euro Spec SN/CF 1849-001, Товары автосервиса\90A0B807.jpg, Idemitsu,1, 1730
53,Моторное масло Helix Ultra 550046367, Товары автосервиса\F2E0E078.jpg, Shell,0, 1650
54,Моторное масло QUARTZ 9000 FUTURE NFC 183199, Товары автосервиса\6CE0A012.jpg, Total,1,2040
55,Моторное масло Dexos 2 93165554, Товары автосервиса\45008C52.jpg, General Motors,1,1380
56,Моторное масло Formula F Fuel Economy HC 155D4B, Товары автосервиса\39A0C188.jpg, Ford,1,1450
57,Моторное масло 76 08880-803ENGINE OIL-GO, Товары автосервиса\0070C563.jpg, Toyota,1,1630
58,Моторное масло QUARTZ 9000 FUTURE NFC 183450, Товары автосервиса\FA90B138.jpg, Total,1, 1660
59,Моторное масло Top Tec 4100 7501, Товары автосервиса\022096CB.jpg, Liqui Moly,1, 2580
60,Моторное масло Mobil 1 ESP 154279, Товары автосервиса\F460E078.jpg, Mobil,1,1860
61,Моторное масло Super 3000 X1 152061, Товары автосервиса\40409946.jpg, Mobil,1,2010
62,Моторное масло Super Extra Gasoline 05100-00410, Товары автосервиса\2A109062.jpg, Hyundai/Kia,1,1230
63,Моторное масло Dexos 2 93165556, Товары автосервиса\43E08C52.jpg, General Motors,1,1340
64,Моторное масло Leichtlauf Special AA 7516, Товары автосервиса\47E07CB5.jpg, Liqui Moly,1,2360
65,Моторное масло Helix HX8 A5/B5 550046777, Товары автосервиса\F160E078.jpg, Shell,1,1530
66,Моторное масло Fuel Economy 08880-80845, Товары автосервиса\23106A35.jpg, Toyota,1, 2560
67,Моторное масло 76 Top Tec 420061, Товары автосервиса\03D096CB.jpg, Liqui Moly,1,3440
68,Моторное масло X9 162613, Товары автосервиса\30E0C751.jpg, ZIC,1,1530
69,Моторное масло EDGE Professional LL III Titanium FST 157AD6, Товары автосервиса\96E0C1E7.jpg, Castrol,1,1760
70,Моторное масло Magnatec A3/B4 156E9D, Товары автосервиса\9290C1E7.jpg, Castrol,1,1610
71,Моторное масло Genuine A000989790213BIFR, Товары автосервиса\2E60E06C.jpg, Mercedes,1,2390
72,Моторное масло Supreme Synthetic MOSYN53C16, Товары автосервиса\69C0CD62.jpg, Petro-Canada,1,1910
73,Моторное масло Helix Ultra Pro AM-L 550046353, Товары автосервиса\3DF0E4BC.jpg, Shell,1, 2110
74,Моторное масло QUARTZ INEO ECS 151510, Товары автосервиса\8F609ED7.jpg, Total,1,1920
75,Моторное масло Original oil Ultra 0530-05-TFE, Товары автосервиса\85C04040.jpg, Mazda,1,2930
76,Моторное масло QUARTZ 9000 ENERGY HKS 175393, Товары автосервиса\6DD0A012.jpg, Total,1, 2830
77,Моторное масло Ultra LEO-SN 08217-99974, Товары автосервиса\97809225.jpg, Honda,1,2980
78,Моторное масло Special G G 052 502 M4, Товары автосервиса\E0A0E079.jpg, VAG,1,3090
79,Моторное масло Люкс 207465, Товары автосервиса\8E20A863.jpg, Lukoil,1,1090
80,Жилет светоотражающий взрослый ARW-AV-02, Товары автосервиса\D4D0CE67.jpg, Airline,1, 150
81,Моторное масло Premium LF Gasoline 05100-00451, Товары автосервиса\2B609062.jpg, Hyundai/Kia,1,1620
82,Моторное масло Evolution 900 SXR 10160501, Товары автосервиса\BD80E8D5.jpg, Elf,1,1750
83,Моторное масло Zepro Touring 1845-004, Товары автосервиса\5180B90E.jpg, Idemitsu,1,2380
84,Моторное масло 76 A000989PKW Motorenol0213BLER, Товары автосервиса\2E00E06C.jpg, Mercedes,1,2510
85,Моторное масло QUARTZ 9000 ENERGY HKS 175392, Товары автосервиса\6DA0A012.jpg, Total,0,1530
86,Моторное масло Formula F 155D3A, Товары автосервиса\39D0C188.jpg, Ford,1,1830
87,Моторное масло Mobil 1 FS 153692, Товары автосервиса\6080DCD5.jpg, Mobil,1,3020
88,Моторное масло Zepro Eco Medalist 3583-004, Товары автосервиса\3DA0B713.jpg, Idemitsu,1,2520
89,Моторное масло SN 08880-10706, Товары автосервиса\43C09176.jpg, Toyota,1, 1640
90,Моторное масло Dexos 2 19 42 003, Товары автосервиса\8430842A.jpg, Opel,1, 1490
91,Моторное масло ENGINE OIL 08880-80365-GO, Товары автосервиса\CC10C869.jpg, Toyota,1,3580
92,Моторное масло EDGE LL Titanium FST 15669A, Товары автосервиса\8BC0C1A9.jpg, Castrol,1,3000
93,Моторное масло QUARTZ 9000 148597, Товары автосервиса\8F909ED7.jpg, Total,0,1700
94,Моторное масло ENGINE OIL MZ 320756, Товары автосервиса\5BE0C351.jpg, Mitsubishi,0,1600
95,Кредитница  Кожа B6 6 95 1349, Товары автосервиса\63C09E91.jpg, Mercedes,1,6770
96,Моторное масло Zepro Touring 1845-001, Товары автосервиса\7B70B9C6.jpg, Idemitsu,1,1720
97,Моторное масло ENGINE OIL MZ 320757, Товары автосервиса\0D30C4EE.jpg, Mitsubishi,1,2210
98,Моторное масло Zepro Eco Medalist 3583-001, Товары автосервиса\6800BB8A.jpg, Idemitsu,1,1770
99,Моторное масло Premium DPF Diesel 05200-00620, Товары автосервиса\9B3075EB.jpg, Hyundai/Kia,1,2470
100,Моторное масло QUARTZ 9000 FUTURE NFC 10230501, Товары автосервиса\3970E753.jpg, Total,0,1650
